{
  "city_id": "hong-kong",
  "display": "Hong Kong",
  "region": "SEA",
  "tagline": "One of the world's great harbour cities — a dense ferry network ready for foiling.",
  "summary": "Hong Kong is built on the water: Victoria Harbour, the Outlying Islands and a mature, high-volume ferry network. Pioneer II upgrades the inner-harbour and island routes to fast, smooth, zero-emission service; Quanta-LR's hybrid range opens the Pearl River Delta cross-border corridors as single legs.",
  "demand_signals": [
    { "label": "Ferry ridership", "value": "Mature high-volume network", "note": "Star Ferry, Outlying Islands and harbour services carry huge daily volumes", "archetype": "public_transit" },
    { "label": "Outlying-island demand", "value": "Lantau · Lamma · Cheung Chau · Discovery Bay", "note": "Island-commuter and leisure corridors served by conventional ferries", "archetype": "tourism" },
    { "label": "PRD cross-border", "value": "Macau · Shenzhen · Zhuhai", "note": "High-frequency delta crossings within hybrid range", "archetype": "super_app" },
    { "label": "Event + cruise nodes", "value": "Kai Tak · West Kowloon", "note": "New waterfront venues driving event-day surge demand", "archetype": "corporate" }
  ],
  "use_cases": [
    { "archetype": "public_transit", "title": "Premium harbour + island tier", "body": "A quiet, zero-emission foiling layer across Victoria Harbour and the Outlying Islands — faster and smoother than today's ferries.", "platform": "Pioneer II" },
    { "archetype": "tourism", "title": "Outlying-island leisure", "body": "Comfortable, fast hops to Lantau, Lamma and Cheung Chau, plus the Kai Tak waterfront venues.", "platform": "Pioneer II" },
    { "archetype": "super_app", "title": "PRD cross-border corridor", "body": "Hong Kong to Macau, Shenzhen and Zhuhai as fast, smooth hybrid legs.", "platform": "both" }
  ],
  "navier_fit": {
    "pioneer_ii": "All-electric harbour and Outlying-Islands corridors with berth-pedestal charging — a premium layer on a mature ferry culture.",
    "quanta_lr": "Opens the Pearl River Delta cross-border corridors — Macau, Shenzhen, Zhuhai — as single hybrid legs with no charging-infrastructure dependency."
  },
  "signature_routes": [
    "Hong Kong ↔ Macau / Zhuhai (PRD cross-border hybrid)",
    "Central ↔ Outlying Islands (Lantau · Lamma · Cheung Chau) — all-electric",
    "Victoria Harbour premium network (all-electric)"
  ],
  "transit_planning": "For an authority: a premium, zero-emission tier above the mature ferry network — upgraded inner-harbour and island corridors plus credible PRD cross-border lines — additive to existing services.",
  "partner_overlays": {}
}
